{
  "$schema": "./docs/rules.schema.json",
  "version": "1.0.0",
  "desk": "warden-desk",
  "manifest": "seven rules. seven agents enforce one each. the eighth agent, WARDEN, checks every manual order against all seven and has no override.",
  "money": {
    "position_size_usd": 50.0,
    "currency": "USD",
    "note": "sizing is used for cost math only. this repository never signs a transaction."
  },
  "rules": [
    {
      "id": "R1",
      "agent": "GRAVEYARD",
      "title": "only what already died",
      "asks": "is this coin actually on the floor of an empty curve?",
      "params": {
        "floor_usd": 1800,
        "floor_band_usd": 700,
        "max_cap_usd": 60000,
        "min_age_days": 365
      },
      "denies": "coin is still bid, or too young to be a corpse",
      "note": "deliberately says nothing about how long the coin has been silent. Silence is WARDEN's question, and a graveyard rule that demanded it would contradict max_silence_days below - nothing could ever pass both.",
      "source": "floor and age bands chosen where the launch snapshot separates dead curves from quiet ones"
    },
    {
      "id": "R2",
      "agent": "MIDWIFE",
      "title": "count names, not candles",
      "asks": "is someone manufacturing a wave on this ticker right now?",
      "params": {
        "window_seconds": 21600,
        "min_copies": 8,
        "min_wallets": 5,
        "original_older_than_seconds": 7200,
        "max_wave_age_minutes": 20
      },
      "denies": "too few copies, copies spread over days, or one wallet spamming itself",
      "source": "copy counts and wallet spread measured on the bundled launch feed"
    },
    {
      "id": "R3",
      "agent": "COLLECTOR",
      "title": "the original, never the clone",
      "asks": "am i about to buy the corpse, or the copy of it?",
      "params": {
        "buy_original_only": true,
        "max_move_pct_since_wave": 0.0,
        "min_holders": 2
      },
      "denies": "target is a clone, or the original already moved",
      "source": "clone-vs-original split, taken from name collisions in the snapshot"
    },
    {
      "id": "R4",
      "agent": "CLOCK",
      "title": "the sell button stays locked",
      "asks": "has the position been held long enough to be allowed to close?",
      "params": {
        "lock_seconds": 300,
        "stop_loss_pct": -25.0,
        "stop_overrides_lock": true
      },
      "denies": "manual exit inside the lock window while the stop has not fired",
      "source": "a lock long enough that an exit is a decision, not a reflex; stop is the only override"
    },
    {
      "id": "R5",
      "agent": "TOLL",
      "title": "the toll is counted in real time",
      "asks": "is the hour's fee bill eating the hour's profit?",
      "params": {
        "fee_rate_per_side": 0.0125,
        "network_fee_sol": 0.0005,
        "freeze_when_fees_exceed_profit_share": 0.5,
        "freeze_seconds": 3600
      },
      "denies": "new entries while fees paid this hour exceed half the profit made this hour",
      "source": "published pump.fun fee schedule (1.25% per side) plus the Solana base fee"
    },
    {
      "id": "R6",
      "agent": "LADDER",
      "title": "add to winners only",
      "asks": "is this position already in profit before i add to it?",
      "params": {
        "add_only_if_open_pnl_pct_above": 0.0,
        "averaging_down": false,
        "max_adds": 3,
        "add_size_fraction": 0.5
      },
      "denies": "any add to a losing position - averaging down is a desk-level ban with no override",
      "source": "position sizing rule: adds go to winners, averaging down is banned outright"
    },
    {
      "id": "R7",
      "agent": "UNDERTAKER",
      "title": "the thesis has a clock",
      "asks": "has the reason for this trade expired?",
      "params": {
        "thesis_timeout_seconds": 21600,
        "close_at_market": true
      },
      "denies": "holding past the thesis timer because it might still work",
      "source": "a thesis with no expiry is not a thesis; six hours is the shelf life used here"
    }
  ],
  "warden": {
    "agent": "WARDEN",
    "title": "the agent that says no",
    "asks": "if i buy this, who buys it from me?",
    "enforces": [
      "R1",
      "R2",
      "R3",
      "R4",
      "R5",
      "R6",
      "R7"
    ],
    "override": false,
    "exit_liquidity": {
      "note": "WARDEN's own checks. every one is about the exit, none about the upside. this is the only place the desk disagrees with itself: GRAVEYARD wants a corpse, WARDEN wants a live book.",
      "min_holders": 25,
      "max_top10_share": 0.25,
      "max_silence_days": 30,
      "min_cap_usd": 5000,
      "verdict_cooldown_hours": 24,
      "max_open_positions": 3,
      "source": "warden.py, live desk, 42 refusals recorded"
    }
  }
}
